Full - Name;EDID;
Plan: Skeleton Costume;recipe_Clothes_HalloweenCostume02_Skeleton; (Fight For Freedom)
Plan: Ski Sword;Recipe_Weapon_Melee_SkiSword; (Fight For Freedom)
Plan: Ski Sword Skate Blade;recipe_mod_melee_SkiSword_SkateBlade; (Fight For Freedom)
Plan: Skiing Outfit;recipe_Clothes_SkiingPurpleAndWhiteOutfit; (Fight For Freedom)
Plan: Sledge Hammer;Recipe_Weapon_Melee_Sledgehammer; (Fight For Freedom)
Plan: Sledgehammer Heavy Searing Sharp Rocket;recipe_DLC04_mod_melee_Sledgehammer_ExtraHeavyHead_Rocket_Blades_Heated; (Fight For Freedom)
Plan: Sledgehammer Heavy Sharp Rocket;recipe_DLC04_mod_melee_Sledgehammer_ExtraHeavyHead_Rocket_Blades; (Fight For Freedom)
Plan: Sledgehammer Heavy Spiked Rocket;recipe_DLC04_mod_melee_Sledgehammer_ExtraHeavyHead_Rocket_Spikes; (Fight For Freedom)
Plan: Slocum Joe's Power Armor Paint;recipe_mod_PowerArmor_Material_Paint_SlocumsJoe_NW; (Fight For Freedom)
Plan: Small Backpack;Recipe_Armor_Backpack_Small; (Fight For Freedom)
Plan: Small Letters Set;Recipe_Workshop_WallDecor_Signs_SmallLetters; (Fight For Freedom)
Plan: Small Supply Crate;Recipe_Workshop_Container_StashBox_Supply_Crate_Small; (Fight For Freedom)
Plan: Small Vault Girl Statue;Recipe_Workshop_FloorDecor_Statue_Small_Posed_VaultGirl; (Fight For Freedom)
Plan: Smart Frag Grenade;POST_Recipe_Tinkers_GrenadeFragSmart; (Fight For Freedom)
Plan: Smoke Grenade;Recipe_Weapon_Thrown_SmokeGrenade; (Fight For Freedom)
Plan: Snallygaster Plushie;Recipe_Workshop_FloorDecor_Plushie_Snallygaster; (Fight For Freedom)
Plan: Solar Armor Chest Piece;Recipe_Armor_EnclaveScoutUniform_Torso_Set_V94_Solar_GoldVendor; (Fight For Freedom)
Plan: Solar Armor Left Arm;Recipe_Armor_EnclaveScoutUniform_ArmLeft_Set_V94_Solar_GoldVendor; (Fight For Freedom)
Plan: Solar Armor Left Leg;Recipe_Armor_EnclaveScoutUniform_LegLeft_Set_V94_Solar_GoldVendor; (Fight For Freedom)
Plan: Solar Armor Right Arm;Recipe_Armor_EnclaveScoutUniform_ArmRight_Set_V94_Solar_GoldVendor; (Fight For Freedom)
Plan: Solar Armor Right Leg;Recipe_Armor_EnclaveScoutUniform_LegRight_Set_V94_Solar_GoldVendor; (Fight For Freedom)
Plan: Sole Survivor;Recipe_Weapon_Ranged_LeverGun_SoleSurvivor_30; (Fight For Freedom)
Plan: Solomon Hardy;SCORE_Recipe_workshop_CAMP_Ally_SolomonHardy_GoldVendor; (Fight For Freedom)
Plan: Soundmaker;zzz_Recipe_Tinkers_SoundmakerGrenade; (Fight For Freedom)
Plan: Spear;Recipe_Weapon_Melee_Spear; (Fight For Freedom)
Plan: Speed Bag;SCORE_Recipe_workshop_CAMP_Utility_SpeedBag_GoldVendor; (Fight For Freedom)
Plan: Spicy Tenderizer Mod;recipe_mod_melee_MeatTenderizer_Heated; (Fight For Freedom)
Plan: Spiked Electro Enforcer;Recipe_mod_melee_ElectroEnforcer_Spiked; (Fight For Freedom)
Plan: Spiked Paddle Ball;CUT_recipe_mod_PaddleBall_Spikes; (Fight For Freedom)
Plan: Spiked Shepherd's Crook;recipe_mod_melee_ShepherdsCrook_Spiked; (Fight For Freedom)
Plan: Spiked Walking Cane;recipe_mod_melee_WalkingCane_Spikes; (Fight For Freedom)
Plan: Spin the Wheel Ornament;E09B_Workshop_Recipe_Ornament; (Fight For Freedom)
Plan: Spin The Wheel Poster;zzzRecipe_Workshop_NWOTPoster; (Fight For Freedom)
Plan: Spin The Wheel Posters;E09B_Workshop_Recipe_Poster; (Fight For Freedom)
Plan: Spin the Wheel Snow Globe;E09B_Recipe_Workshop_FloorDecor_Snowglobe_STW; (Fight For Freedom)
Plan: Spinning Rack;zzz_Recipe_Workshop_Shelves_MagazineRackContainer01; (Fight For Freedom)
Plan: Spy Outfit;recipe_Clothes_SpyOutfit; (Fight For Freedom)
Plan: Standard Backpack;Recipe_Armor_Backpack_Standard; (Fight For Freedom)
Plan: Standing Gorilla;Recipe_Workshop_FloorDecor_Taxidermy_Gorilla_Standing; (Fight For Freedom)
Plan: Starburst Clock;Recipe_Workshop_WallDecor_WallClocks_Starburst; (Fight For Freedom)
Plan: Steven Scarberry;SCORE_Recipe_workshop_CAMP_Ally_Steven_Scarberry_GoldVendor; (Fight For Freedom)
Plan: Stone Benches;Recipe_Workshop_Benches_Stone; (Fight For Freedom)
Plan: Stone Fountain;Recipe_Workshop_FloorDecor_Statues_Fountain01; (Fight For Freedom)
Plan: Strangler Heart Chest Piece;Recipe_Armor_PowerArmor_Ultracite_Set_V94_Torso_GoldVendor; (Fight For Freedom)
Plan: Strangler Heart Helmet;Recipe_Armor_PowerArmor_Ultracite_Set_V94_Helmet_GoldVendor; (Fight For Freedom)
Plan: Strangler Heart Left Arm;Recipe_Armor_PowerArmor_Ultracite_Set_V94_ArmLeft_GoldVendor; (Fight For Freedom)
Plan: Strangler Heart Left Leg;Recipe_Armor_PowerArmor_Ultracite_Set_V94_LegLeft_GoldVendor; (Fight For Freedom)
Plan: Strangler Heart Right Arm;Recipe_Armor_PowerArmor_Ultracite_Set_V94_ArmRight_GoldVendor; (Fight For Freedom)
Plan: Strangler Heart Right Leg;Recipe_Armor_PowerArmor_Ultracite_Set_V94_LegRight_GoldVendor; (Fight For Freedom)
Plan: Street Lights;Recipe_Workshop_Lights_StreetLamps; (Fight For Freedom)
Plan: Strengthened Combat Armor Limbs;recipe_mod_armor_Combat_Lining_Limb_ResistanceLimbDamage; (Fight For Freedom)
Plan: Strengthened Leather Armor Limbs;recipe_mod_armor_Leather_Lining_Limb_ResistanceLimbDamage; (Fight For Freedom)
Plan: Strengthened Marine Armor Limbs;recipe_DLC03_mod_armor_Marine_Lining_Limb_ResistanceLimbDamage; (Fight For Freedom)
Plan: Strengthened Metal Armor Limbs;recipe_mod_armor_Metal_Lining_Limb_ResistanceLimbDamage; (Fight For Freedom)
Plan: Strengthened Raider Armor Limbs;recipe_mod_armor_RaiderMod_Lining_Limb_ResistanceLimbDamage; (Fight For Freedom)
Plan: Strengthened Robot Armor Limbs;recipe_mod_armor_Robot_Lining_Limb_ResistanceLimbDamage; (Fight For Freedom)
Plan: Strengthened Trapper Armor Limbs;recipe_mod_armor_Trapper_Lining_Limb_ResistanceLimbDamage; (Fight For Freedom)
Plan: Strongman's Super Sledge Paint;Recipe_mod_SuperSledge_Melee_Paint_StrongmanHammer; (Fight For Freedom)
Plan: Sturdy Combat Arms;Recipe_Armor_Combat_Arms_Medium; (Fight For Freedom)
Plan: Sturdy Combat Legs;Recipe_Armor_Combat_Legs_Medium; (Fight For Freedom)
Plan: Sturdy Combat Torso;Recipe_Armor_Combat_Torso_Medium; (Fight For Freedom)
Plan: Sturdy Leather Arms;Recipe_Armor_Leather_Arms_Medium; (Fight For Freedom)
Plan: Sturdy Leather Legs;Recipe_Armor_Leather_Legs_Medium; (Fight For Freedom)
Plan: Sturdy Leather Torso;Recipe_Armor_Leather_Torso_Medium; (Fight For Freedom)
Plan: Sturdy Metal Arms;Recipe_Armor_Metal_Arms_Medium; (Fight For Freedom)
Plan: Sturdy Metal Legs;Recipe_Armor_Metal_Legs_Medium; (Fight For Freedom)
Plan: Sturdy Metal Torso;Recipe_Armor_Metal_Torso_Medium; (Fight For Freedom)
Plan: Sturdy Raider Arms;Recipe_Armor_RaiderMod_Arms_Medium; (Fight For Freedom)
Plan: Sturdy Raider Legs;Recipe_Armor_RaiderMod_Legs_Medium; (Fight For Freedom)
Plan: Sturdy Raider Torso;Recipe_Armor_RaiderMod_Torso_Medium; (Fight For Freedom)
Plan: Sturdy Robot Arms;recipe_Armor_Robot_Medium_Arms; (Fight For Freedom)
Plan: Sturdy Robot Legs;recipe_Armor_Robot_Medium_Legs; (Fight For Freedom)
Plan: Sturdy Robot Torso;recipe_Armor_Robot_Medium_Torso; (Fight For Freedom)
Plan: Submachine Gun;Recipe_Weapon_Ranged_SubmachineGun; (Fight For Freedom)
Plan: Submachine Gun Armor Piercing Receiver;recipe_mod_SubmachineGun_Receiver_Automatic1_and_ArmorPiercing; (Fight For Freedom)
Plan: Submachine Gun Hardened Receiver;recipe_mod_SubmachineGun_Receiver_Automatic1_and_MoreDamage1; (Fight For Freedom)
Plan: Submachine Gun Scorched Killer's Receiver;recipe_mod_SubmachineGun_Receiver_ScorchedKiller; (Fight For Freedom)
Plan: Suitcase;Recipe_Workshop_Container_Prewar_Suitcase_Clothes_Clean; (Fight For Freedom)
Plan: Suitcase - Black;Recipe_Workshop_Container_Prewar_Suitcase_Clothes_Clean_Black; (Fight For Freedom)
Plan: Suitcase - Blue;Recipe_Workshop_Container_Prewar_Suitcase_Clothes_Clean_Blue; (Fight For Freedom)
Plan: Suitcase - Green;Recipe_Workshop_Container_Prewar_Suitcase_Clothes_Clean_Green; (Fight For Freedom)
Plan: Suitcase - Orange;Recipe_Workshop_Container_Prewar_Suitcase_Clothes_Clean_Orange; (Fight For Freedom)
Plan: Suitcase - Pink;Recipe_Workshop_Container_Prewar_Suitcase_Clothes_Clean_Pink; (Fight For Freedom)
Plan: Suitcase - Purple;Recipe_Workshop_Container_Prewar_Suitcase_Clothes_Clean_Purple; (Fight For Freedom)
Plan: Suitcase - Red;Recipe_Workshop_Container_Prewar_Suitcase_Clothes_Clean_Red; (Fight For Freedom)
Plan: Suitcase - Yellow;Recipe_Workshop_Container_Prewar_Suitcase_Clothes_Clean_Yellow; (Fight For Freedom)
Plan: Super Mutant BBQ Grill;Recipe_Workshop_FloorDecor_Misc_MeatWeek_BBQGrill; (Fight For Freedom)
Plan: Super Mutant Diagram;Recipe_Workshop_Lights_Wall_SuperMutantDiagram; (Fight For Freedom)
Plan: Super Mutant Grill;Recipe_Workshop_Appliances_Grill_SuperMutant; (Fight For Freedom)
Plan: Super Mutant Tube;Recipe_Workshop_SuperMutantTube; (Fight For Freedom)
Plan: Super Reactor;Recipe_Workshop_Power_Generator_SuperReactor; (Fight For Freedom)
Plan: Super Sledge;Recipe_Weapon_Melee_SuperSledge; (Fight For Freedom)
Plan: Surprised Jack O'Lantern;Recipe_Workshop_FloorDecor_PumpkinCarved05; (Fight For Freedom)
Plan: Survivor's Bow Skin;Recipe_mod_RegularBow_Material_Paint_SurvivorsPaint_Survivors2020_NW; (Fight For Freedom)
Plan: Survivor's Cattle Prod Skin;Recipe_mod_CattleProd_Material_Paint_SurvivorsPaint_Survivors2020_NW; (Fight For Freedom)
Plan: Survivors Denim Underarmor;Recipe_Armor_SurvivorsDenim_Underarmor_Survivors2020_NW; (Fight For Freedom)
Plan: Switchblade;Recipe_Weapon_Melee_Switchblade; (Fight For Freedom)
Plan: Switchblade Serrated Blade;recipe_mod_melee_Switchblade_Serrated; (Fight For Freedom)
Plan: Sympto-Matic;Recipe_Workshop_MiscStructures_SymptoMatic; (Fight For Freedom)
Plan: Syringer Long NV Scope;recipe_mod_PipeSyringer_Scope_ScopeLong_NV; (Fight For Freedom)
Plan: Syringer Medium NV Scope;recipe_mod_PipeSyringer_Scope_ScopeMedium_NV; (Fight For Freedom)
Plan: Syringer Short NV Scope;recipe_mod_PipeSyringer_Scope_ScopeShort_NV; (Fight For Freedom)
Plan: T-45 Blood Cleanser;recipe_mod_PowerArmor_T45_Torso_Misc_Cleanser; (Fight For Freedom)
Plan: T-45 Calibrated Shocks;recipe_mod_PowerArmor_T45_Leg_Misc_Carry; (Fight For Freedom)
Plan: T-45 Chest Piece;recipe_Armor_PowerArmor_T45_Torso; (Fight For Freedom)
Plan: T-45 Cooling Vent;recipe_mod_PowerArmor_T45_Leg_Misc_ExplVent; (Fight For Freedom)
Plan: T-45 Core Assembly;recipe_mod_PowerArmor_T45_Torso_Misc_BatRegen; (Fight For Freedom)
Plan: T-45 Emergency Protocols;recipe_mod_PowerArmor_T45_Torso_Misc_Emergency; (Fight For Freedom)
Plan: T-45 Headlamp;POST_recipe_mod_PowerArmor_T45_Helmet_Headlamp; (Fight For Freedom)
Plan: T-45 Headlamp Blue;POST_recipe_mod_PowerArmor_T45_Helmet_Headlamp_Blue; (Fight For Freedom)
Plan: T-45 Headlamp Bright;POST_recipe_mod_PowerArmor_T45_Helmet_Headlamp_Bright; (Fight For Freedom)
Plan: T-45 Headlamp Purple;POST_recipe_mod_PowerArmor_T45_Helmet_Headlamp_Purple; (Fight For Freedom)
Plan: T-45 Headlamp Red Tactical;POST_recipe_mod_PowerArmor_T45_Helmet_Headlamp_RedTactical; (Fight For Freedom)
Plan: T-45 Headlamp Vault Boy;POST_recipe_mod_PowerArmor_T45_Helmet_Headlamp_VaultBoy; (Fight For Freedom)
Plan: T-45 Helm;recipe_Armor_PowerArmor_T45_Helmet; (Fight For Freedom)
Plan: T-45 Hydraulic Bracers;recipe_mod_PowerArmor_T45_Arm_Misc_Unarmed; (Fight For Freedom)
Plan: T-45 Internal Database;recipe_mod_PowerArmor_T45_Helmet_Misc_Int; (Fight For Freedom)
Plan: T-45 Jet Pack;recipe_mod_PowerArmor_T45_Torso_Misc_JetPack; (Fight For Freedom)
Plan: T-45 Kinetic Dynamo;recipe_mod_PowerArmor_T45_Torso_Misc_Kinetic; (Fight For Freedom)
Plan: T-45 Kinetic Servos;recipe_mod_PowerArmor_T45_Leg_Misc_APRegen; (Fight For Freedom)
Plan: T-45 Left Arm;recipe_Armor_PowerArmor_T45_ArmLeft; (Fight For Freedom)
Plan: T-45 Left Leg;recipe_Armor_PowerArmor_T45_LegLeft; (Fight For Freedom)
Plan: T-45 Medic Pump;recipe_mod_PowerArmor_T45_Torso_Misc_MedicPump; (Fight For Freedom)
Plan: T-45 Military Paint;recipe_mod_PowerArmor_T45_Material_Paint_Military; (Fight For Freedom)
Plan: T-45 Motion-Assist Servos;recipe_mod_PowerArmor_T45_Torso_Misc_Str; (Fight For Freedom)
Plan: T-45 Optimized Bracers;recipe_mod_PowerArmor_T45_Arm_Misc_Optimized; (Fight For Freedom)
Plan: T-45 Optimized Servos;recipe_mod_PowerArmor_T45_Leg_Misc_OptimizedServos; (Fight For Freedom)
Plan: T-45 Overdrive Servos;recipe_mod_PowerArmor_T45_Leg_Misc_SprintBoost; (Fight For Freedom)
Plan: T-45 Reactive Plates;recipe_mod_PowerArmor_T45_Torso_Misc_Reactive; (Fight For Freedom)
Plan: T-45 Recon Sensors;recipe_mod_PowerArmor_T45_Helmet_Misc_Recon; (Fight For Freedom)
Plan: T-45 Right Arm;recipe_Armor_PowerArmor_T45_ArmRight; (Fight For Freedom)
Plan: T-45 Right Leg;recipe_Armor_PowerArmor_T45_LegRight; (Fight For Freedom)
Plan: T-45 Rusty Knuckles;recipe_mod_PowerArmor_T45_Arm_Misc_Bleed; (Fight For Freedom)
Plan: T-45 Sensor Array;recipe_mod_PowerArmor_T45_Helmet_Misc_Sensor; (Fight For Freedom)
Plan: T-45 Stealth Boy;recipe_mod_PowerArmor_T45_Torso_Misc_StealthBoy; (Fight For Freedom)
Plan: T-45 Targeting HUD;recipe_mod_PowerArmor_T45_Helmet_Misc_DetectLife; (Fight For Freedom)
Plan: T-45 Tesla Bracers;recipe_mod_PowerArmor_T45_Arm_Misc_ShockDmg; (Fight For Freedom)
Plan: T-45 Tesla Coils;recipe_mod_PowerArmor_T45_Torso_Misc_Tesla; (Fight For Freedom)
Plan: T-45 VATS Matrix Overlay;recipe_mod_PowerArmor_T45_Helmet_Misc_VATSChance; (Fight For Freedom)
Plan: T-45 Winterized Paint;recipe_mod_PowerArmor_T45_Material_Paint_Winterized; (Fight For Freedom)
Plan: T-51 Power Armor Brotherhood Knight Paint;recipe_mod_PowerArmor_T51_Material_Paint_NewBOS_Knight; (Fight For Freedom)
Plan: T-51 Power Armor Brotherhood Knight Paint;recipe_mod_PowerArmor_T51_Material_Paint_NewBOS_KnightDUPLICATE000; (Fight For Freedom)
Plan: T-51 Power Armor Brotherhood Paladin Paint;recipe_mod_PowerArmor_T51_Material_Paint_NewBOS_Paladin; (Fight For Freedom)
Plan: T-51 Power Armor Brotherhood Paladin Paint;recipe_mod_PowerArmor_T51_Material_Paint_NewBOS_PaladinDUPLICATE000; (Fight For Freedom)
Plan: T-51 Power Armor Nuka-Cola Paint;recipe_mod_PowerArmor_T51_Material_Paint_NukaCola; (Fight For Freedom)
Plan: T-51b Blood Cleanser;recipe_mod_PowerArmor_T51_Torso_Misc_Cleanser; (Fight For Freedom)
Plan: T-51b Calibrated Shocks;recipe_mod_PowerArmor_T51_Leg_Misc_Carry; (Fight For Freedom)
Plan: T-51b Chest Piece;recipe_Armor_PowerArmor_T51_Torso; (Fight For Freedom)
Plan: T-51b Cooling Vent;recipe_mod_PowerArmor_T51_Leg_Misc_ExplVent; (Fight For Freedom)
Plan: T-51b Core Assembly;recipe_mod_PowerArmor_T51_Torso_Misc_BatRegen; (Fight For Freedom)
Plan: T-51b Emergency Protocols;recipe_mod_PowerArmor_T51_Torso_Misc_Emergency; (Fight For Freedom)
Plan: T-51b Headlamp;POST_recipe_mod_PowerArmor_T51_Helmet_Headlamp; (Fight For Freedom)
Plan: T-51b Headlamp Blue;POST_recipe_mod_PowerArmor_T51_Helmet_Headlamp_Blue; (Fight For Freedom)
Plan: T-51b Headlamp Bright;POST_recipe_mod_PowerArmor_T51_Helmet_Headlamp_Bright; (Fight For Freedom)
Plan: T-51b Headlamp Purple;POST_recipe_mod_PowerArmor_T51_Helmet_Headlamp_Purple; (Fight For Freedom)
Plan: T-51b Headlamp Red Tactical;POST_recipe_mod_PowerArmor_T51_Helmet_Headlamp_RedTactical; (Fight For Freedom)
Plan: T-51b Headlamp Vault Boy;POST_recipe_mod_PowerArmor_T51_Helmet_Headlamp_VaultBoy; (Fight For Freedom)
Plan: T-51b Helm;recipe_Armor_PowerArmor_T51_Helmet; (Fight For Freedom)
Plan: T-51b Hydraulic Bracers;recipe_mod_PowerArmor_T51_Arm_Misc_Unarmed; (Fight For Freedom)
Plan: T-51b Internal Database;recipe_mod_PowerArmor_T51_Helmet_Misc_Int; (Fight For Freedom)
Plan: T-51b Jet Pack;recipe_mod_PowerArmor_T51_Torso_Misc_JetPack; (Fight For Freedom)
Plan: T-51b Kinetic Dynamo;recipe_mod_PowerArmor_T51_Torso_Misc_Kinetic; (Fight For Freedom)
Plan: T-51b Kinetic Servos;recipe_mod_PowerArmor_T51_Leg_Misc_APRegen; (Fight For Freedom)
Plan: T-51b Left Arm;recipe_Armor_PowerArmor_T51_ArmLeft; (Fight For Freedom)
Plan: T-51b Left Leg;recipe_Armor_PowerArmor_T51_LegLeft; (Fight For Freedom)
Plan: T-51b Medic Pump;recipe_mod_PowerArmor_T51_Torso_Misc_MedicPump; (Fight For Freedom)
Plan: T-51b Military Paint;recipe_mod_PowerArmor_T51_Material_Paint_Military; (Fight For Freedom)
Plan: T-51b Motion-Assist Servos;recipe_mod_PowerArmor_T51_Torso_Misc_Str; (Fight For Freedom)
Plan: T-51b Optimized Bracers;recipe_mod_PowerArmor_T51_Arm_Misc_Optimized; (Fight For Freedom)
Plan: T-51b Optimized Servos;recipe_mod_PowerArmor_T51_Leg_Misc_OptimizedServos; (Fight For Freedom)
Plan: T-51b Overdrive Servos;recipe_mod_PowerArmor_T51_Leg_Misc_SprintBoost; (Fight For Freedom)
Plan: T-51b Reactive Plates;recipe_mod_PowerArmor_T51_Torso_Misc_Reactive; (Fight For Freedom)
Plan: T-51b Recon Sensors;recipe_mod_PowerArmor_T51_Helmet_Misc_Recon; (Fight For Freedom)
Plan: T-51b Right Arm;recipe_Armor_PowerArmor_T51_ArmRight; (Fight For Freedom)
Plan: T-51b Right Leg;recipe_Armor_PowerArmor_T51_LegRight; (Fight For Freedom)
Plan: T-51b Rusty Knuckles;recipe_mod_PowerArmor_T51_Arm_Misc_Bleed; (Fight For Freedom)
Plan: T-51b Sensor Array;recipe_mod_PowerArmor_T51_Helmet_Misc_Sensor; (Fight For Freedom)
Plan: T-51b Stealth Boy;recipe_mod_PowerArmor_T51_Torso_Misc_StealthBoy; (Fight For Freedom)
Plan: T-51b Targeting HUD;recipe_mod_PowerArmor_T51_Helmet_Misc_DetectLife; (Fight For Freedom)
Plan: T-51b Tesla Bracers;recipe_mod_PowerArmor_T51_Arm_Misc_ShockDmg; (Fight For Freedom)
Plan: T-51b Tesla Coils;recipe_mod_PowerArmor_T51_Torso_Misc_Tesla; (Fight For Freedom)
Plan: T-51b VATS Matrix Overlay;recipe_mod_PowerArmor_T51_Helmet_Misc_VATSChance; (Fight For Freedom)
Plan: T-51b Vim! Paint;POST_recipe_mod_PowerArmor_T51_Material_Paint_VimRed; (Fight For Freedom)
Plan: T-51b Winterized Coating;recipe_mod_PowerArmor_T51_Material_Paint_Winterized; (Fight For Freedom)
Plan: T-60 Atom Cat Paint;recipe_mod_PowerArmor_T60_Material_Paint_AtomCat; (Fight For Freedom)
Plan: T-60 Blood Cleanser;recipe_mod_PowerArmor_T60_Torso_Misc_Cleanser; (Fight For Freedom)
Plan: T-60 BOS Elder Paint;recipe_mod_PowerArmor_T60_Material_Paint_BOSElder; (Fight For Freedom)
Plan: T-60 BOS Initiate Paint;DEPRECATED_recipe_mod_PowerArmor_T60_Material_Paint_BOSInitiate; (Fight For Freedom)
Plan: T-60 BOS Knight CPT Paint;recipe_mod_PowerArmor_T60_Material_Paint_BOSKnightCaptain; (Fight For Freedom)
Plan: T-60 BOS Knight Paint;recipe_mod_PowerArmor_T60_Material_Paint_BOSKnight; (Fight For Freedom)
Plan: T-60 BOS Knight SGT Paint;recipe_mod_PowerArmor_T60_Material_Paint_BOSKnightSgt; (Fight For Freedom)
Plan: T-60 BOS Officer Paint;recipe_mod_PowerArmor_T60_Material_Paint_BOSOfficer; (Fight For Freedom)
Plan: T-60 BOS Paladin Paint;recipe_mod_PowerArmor_T60_Material_Paint_BOSPaladin; (Fight For Freedom)
Plan: T-60 BOS Sentinel Paint;DEPRECATED_recipe_mod_PowerArmor_T60_Material_Paint_BOSSentinel; (Fight For Freedom)
Plan: T-60 BOS Standard Paint;zzzrecipe_mod_PowerArmor_T60_Material_Paint_BOSStandard; (Fight For Freedom)
Plan: T-60 Calibrated Shocks;recipe_mod_PowerArmor_T60_Leg_Misc_Carry; (Fight For Freedom)
Plan: T-60 Chest Piece;recipe_Armor_PowerArmor_T60_Torso; (Fight For Freedom)
Plan: T-60 Cooling Vent;recipe_mod_PowerArmor_T60_Leg_Misc_ExplVent; (Fight For Freedom)
Plan: T-60 Core Assembly;recipe_mod_PowerArmor_T60_Torso_Misc_BatRegen; (Fight For Freedom)
Plan: T-60 Emergency Protocols;recipe_mod_PowerArmor_T60_Torso_Misc_Emergency; (Fight For Freedom)
Plan: T-60 Headlamp;POST_recipe_mod_PowerArmor_T60_Helmet_Headlamp; (Fight For Freedom)
Plan: T-60 Headlamp Blue;POST_recipe_mod_PowerArmor_T60_Helmet_Headlamp_Blue; (Fight For Freedom)
Plan: T-60 Headlamp Bright;POST_recipe_mod_PowerArmor_T60_Helmet_Headlamp_Bright; (Fight For Freedom)
Plan: T-60 Headlamp Purple;POST_recipe_mod_PowerArmor_T60_Helmet_Headlamp_Purple; (Fight For Freedom)
Plan: T-60 Headlamp Red Tactical;POST_recipe_mod_PowerArmor_T60_Helmet_Headlamp_RedTactical; (Fight For Freedom)
Plan: T-60 Headlamp Vault Boy;POST_recipe_mod_PowerArmor_T60_Helmet_Headlamp_VaultBoy; (Fight For Freedom)
Plan: T-60 Helm;recipe_Armor_PowerArmor_T60_Helmet; (Fight For Freedom)
Plan: T-60 Hydraulic Bracers;recipe_mod_PowerArmor_T60_Arm_Misc_Unarmed; (Fight For Freedom)
Plan: T-60 Internal Database;recipe_mod_PowerArmor_T60_Helmet_Misc_Int; (Fight For Freedom)
Plan: T-60 Jet Pack;recipe_mod_PowerArmor_T60_Torso_Misc_Jetpack; (Fight For Freedom)
Plan: T-60 Kinetic Dynamo;recipe_mod_PowerArmor_T60_Torso_Misc_Kinetic; (Fight For Freedom)
Plan: T-60 Kinetic Servos;recipe_mod_PowerArmor_T60_Leg_Misc_APRegen; (Fight For Freedom)
Plan: T-60 Left Arm;recipe_Armor_PowerArmor_T60_ArmLeft; (Fight For Freedom)
Plan: T-60 Left Leg;recipe_Armor_PowerArmor_T60_LegLeft; (Fight For Freedom)
Plan: T-60 Medic Pump;recipe_mod_PowerArmor_T60_Torso_Misc_MedicPump; (Fight For Freedom)
Plan: T-60 Military Paint;recipe_mod_PowerArmor_T60_Material_Paint_Military; (Fight For Freedom)
Plan: T-60 Motion-Assist Servos;recipe_mod_PowerArmor_T60_Torso_Misc_Str; (Fight For Freedom)
Plan: T-60 Optimized Bracers;recipe_mod_PowerArmor_T60_Arm_Misc_Optimized; (Fight For Freedom)
Plan: T-60 Optimized Servos;recipe_mod_PowerArmor_T60_Leg_Misc_OptimizedServos; (Fight For Freedom)
Plan: T-60 Overdrive Servos;recipe_mod_PowerArmor_T60_Leg_Misc_SprintBoost; (Fight For Freedom)
Plan: T-60 Reactive Plates;recipe_mod_PowerArmor_T60_Torso_Misc_Reactive; (Fight For Freedom)
Plan: T-60 Recon Sensors;recipe_mod_PowerArmor_T60_Helmet_Misc_Recon; (Fight For Freedom)
Plan: T-60 Right Arm;recipe_Armor_PowerArmor_T60_ArmRight; (Fight For Freedom)
Plan: T-60 Right Leg;recipe_Armor_PowerArmor_T60_LegRight; (Fight For Freedom)
Plan: T-60 Rusty Knuckles;recipe_mod_PowerArmor_T60_Arm_Misc_Bleed; (Fight For Freedom)
Plan: T-60 Sensor Array;recipe_mod_PowerArmor_T60_Helmet_Misc_Sensor; (Fight For Freedom)
Plan: T-60 Stealth Boy;recipe_mod_PowerArmor_T60_Torso_Misc_StealthBoy; (Fight For Freedom)
Plan: T-60 Targeting HUD;recipe_mod_PowerArmor_T60_Helmet_Misc_DetectLife; (Fight For Freedom)
Plan: T-60 Tesla Bracers;recipe_mod_PowerArmor_T60_Arm_Misc_ShockDmg; (Fight For Freedom)
Plan: T-60 Tesla Coils;recipe_mod_PowerArmor_T60_Torso_Misc_Tesla; (Fight For Freedom)
Plan: T-60 VATS Matrix Overlay;recipe_mod_PowerArmor_T60_Helmet_Misc_VATSChance; (Fight For Freedom)
Plan: T-60 Winterized Coating;recipe_mod_PowerArmor_T60_Material_Paint_Winterized; (Fight For Freedom)
Plan: T-65 Blood Cleanser;W05_Recipe_mod_Armor_PowerArmor_T65_Torso_Misc_Cleanser_GoldVendor; (Fight For Freedom)
Plan: T-65 Calibrated Shocks;W05_Recipe_mod_Armor_PowerArmor_T65_Leg_Misc_Carry_GoldVendor; (Fight For Freedom)
Plan: T-65 Cooling Vent;W05_Recipe_mod_Armor_PowerArmor_T65_Leg_Misc_ExplVent_GoldVendor; (Fight For Freedom)
Plan: T-65 Core Assembly;W05_Recipe_mod_Armor_PowerArmor_T65_Torso_Misc_BatRegen_GoldVendor; (Fight For Freedom)
Plan: T-65 Emergency Protocols;W05_Recipe_mod_Armor_PowerArmor_T65_Torso_Misc_Emergency_GoldVendor; (Fight For Freedom)
Plan: T-65 Helm;W05_Recipe_Armor_PowerArmor_T65_Helmet_GoldVendor; (Fight For Freedom)
Plan: T-65 Hydraulic Bracers;W05_Recipe_mod_Armor_PowerArmor_T65_Arm_Misc_Unarmed_GoldVendor; (Fight For Freedom)
Plan: T-65 Jet Pack;W05_Recipe_mod_Armor_PowerArmor_T65_Torso_Misc_Jetpack_GoldVendor; (Fight For Freedom)
Plan: T-65 Kinetic Dynamo;W05_Recipe_mod_Armor_PowerArmor_T65_Torso_Misc_Kinetic_GoldVendor; (Fight For Freedom)
Plan: T-65 Kinetic Servos;W05_Recipe_mod_Armor_PowerArmor_T65_Leg_Misc_APRegen_GoldVendor; (Fight For Freedom)
Plan: T-65 Left Arm;W05_Recipe_Armor_PowerArmor_T65_ArmLeft_GoldVendor; (Fight For Freedom)
Plan: T-65 Left Leg;W05_Recipe_Armor_PowerArmor_T65_LegLeft_GoldVendor; (Fight For Freedom)
Plan: T-65 Medic Pump;W05_Recipe_mod_Armor_PowerArmor_T65_Torso_Misc_MedicPump_GoldVendor; (Fight For Freedom)
Plan: T-65 Motion-Assist Servos;W05_Recipe_mod_Armor_PowerArmor_T65_Torso_Misc_Str_GoldVendor; (Fight For Freedom)
Plan: T-65 Optimized Bracers;W05_Recipe_mod_Armor_PowerArmor_T65_Arm_Misc_Optimized_GoldVendor; (Fight For Freedom)
Plan: T-65 Optimized Servos;W05_Recipe_mod_Armor_PowerArmor_T65_Leg_Misc_OptimizedServos_GoldVendor; (Fight For Freedom)
Plan: T-65 Overdrive Servos;W05_Recipe_mod_Armor_PowerArmor_T65_Leg_Misc_SprintBoost_GoldVendor; (Fight For Freedom)
Plan: T-65 Reactive Plates;W05_Recipe_mod_Armor_PowerArmor_T65_Torso_Misc_Reactive_GoldVendor; (Fight For Freedom)
Plan: T-65 Right Arm;W05_Recipe_Armor_PowerArmor_T65_ArmRight_GoldVendor; (Fight For Freedom)
Plan: T-65 Right Leg;W05_Recipe_Armor_PowerArmor_T65_LegRight_GoldVendor; (Fight For Freedom)
Plan: T-65 Rusty Knuckles;W05_Recipe_mod_Armor_PowerArmor_T65_Arm_Misc_Bleed_GoldVendor; (Fight For Freedom)
Plan: T-65 Stealth Boy;W05_Recipe_mod_Armor_PowerArmor_T65_Torso_Misc_StealthBoy_GoldVendor; (Fight For Freedom)
Plan: T-65 Tesla Bracers;W05_Recipe_mod_Armor_PowerArmor_T65_Arm_Misc_ShockDmg_GoldVendor; (Fight For Freedom)
Plan: T-65 Tesla Coils;W05_Recipe_mod_Armor_PowerArmor_T65_Torso_Misc_Tesla_GoldVendor; (Fight For Freedom)
Plan: T-65 Torso;W05_Recipe_Armor_PowerArmor_T65_Torso_GoldVendor; (Fight For Freedom)
Plan: Table Lamps;Recipe_Workshop_Lights_TableLamps; (Fight For Freedom)
Plan: Table Television;Recipe_Workshop_Appliances_TelevisionTable; (Fight For Freedom)
Plan: Tattered Curtains;Recipe_Workshop_WallDecor_TatteredCurtainsDUPLICATE000_Copy01; (Fight For Freedom)
Plan: Tattered Curtains;Recipe_Workshop_WallDecor_TatteredCurtainsDUPLICATE000DUPLICATE000; (Fight For Freedom)
Plan: Television;Recipe_Workshop_Appliances_Television; (Fight For Freedom)
Plan: Tent;Recipe_Workshop_MiscStructures_Tent_Medium; (Fight For Freedom)
Plan: Terminal;Recipe_Workshop_PowerConnectors_Terminal; (Fight For Freedom)
Plan: Tesla Arc Trap;Recipe_Workshop_Trap_ElectricalArc; (Fight For Freedom)
Plan: Tesla Rifle;Recipe_Weapon_Ranged_LightningGun; (Fight For Freedom)
Plan: Tesla Rifle Charging Shotgun Barrel;recipe_DLC01_mod_LightningGun_Barrel_ChargeShotgun; (Fight For Freedom)
Plan: The Fixer;Recipe_Weapon_Ranged_TheFixer; (Fight For Freedom)
Plan: The Gutter;Recipe_Weapon_Melee_AssaultronBlade_TheGutter; (Fight For Freedom)
